{
  "format": "halka-world-catalog",
  "formatVersion": 3,
  "surfaces": [
    {
      "definitionId": "base_ground",
      "displayName": "草",
      "category": "base",
      "previewSpritePath": "Assets/Content/World/pixel.png",
      "visualWidthPixels": 1,
      "visualHeightPixels": 1,
      "blocksMovement": false,
      "allowedMapTypes": [],
      "editorSelectable": true,
      "growsGrass": true
    },
    {
      "definitionId": "dirt",
      "displayName": "土",
      "category": "surface",
      "previewSpritePath": "Assets/Content/World/dirt.png",
      "visualWidthPixels": 32,
      "visualHeightPixels": 32,
      "editorSelectable": true,
      "blocksMovement": false,
      "allowedMapTypes": []
    },
    {
      "definitionId": "house_floor",
      "displayName": "マット",
      "category": "base",
      "previewSpritePath": "Assets/Content/World/house_floor.png",
      "visualWidthPixels": 32,
      "visualHeightPixels": 32,
      "blocksMovement": false,
      "allowedMapTypes": [],
      "editorSelectable": true
    },
    {
      "definitionId": "house_wall",
      "displayName": "壁",
      "category": "surface",
      "previewSpritePath": "Assets/Content/World/house_wall.png",
      "visualWidthPixels": 32,
      "visualHeightPixels": 32,
      "blocksMovement": true,
      "allowedMapTypes": [],
      "editorSelectable": true
    }
  ],
  "objects": [
    {
      "definitionId": "stone_basic",
      "displayName": "石",
      "category": "nature",
      "previewSpritePath": "Assets/Content/World/stone.png",
      "visualWidthPixels": 32,
      "visualHeightPixels": 32,
      "rootAnchor": "bottom-center",
      "footprint": {
        "width": 1,
        "height": 1
      },
      "blocksMovement": true,
      "excludeGrass": true,
      "editorSelectable": true,
      "blockedCellOffsets": [
        {
          "x": 0,
          "y": 0
        }
      ],
      "allowedMapTypes": [],
      "actionPoints": [
        {
          "id": "examine_front",
          "playerCellOffset": {
            "x": 0,
            "y": -1
          },
          "playerFacing": "up",
          "actionType": "examine",
          "poseKey": null,
          "interactionText": "いし。"
        }
      ]
    },
    {
      "definitionId": "flower_basic",
      "displayName": "花",
      "category": "nature",
      "previewSpritePath": "Assets/Content/World/flower.png",
      "visualWidthPixels": 32,
      "visualHeightPixels": 32,
      "rootAnchor": "bottom-center",
      "footprint": {
        "width": 1,
        "height": 1
      },
      "blocksMovement": true,
      "excludeGrass": true,
      "editorSelectable": true,
      "blockedCellOffsets": [
        {
          "x": 0,
          "y": 0
        }
      ],
      "allowedMapTypes": [],
      "actionPoints": [
        {
          "id": "examine_front",
          "playerCellOffset": {
            "x": 0,
            "y": -1
          },
          "playerFacing": "up",
          "actionType": "examine",
          "poseKey": null,
          "interactionText": "はな。"
        }
      ]
    },
    {
      "definitionId": "tree_basic",
      "displayName": "木",
      "category": "nature",
      "previewSpritePath": "Assets/Content/World/tree.png",
      "visualWidthPixels": 96,
      "visualHeightPixels": 128,
      "rootAnchor": "bottom-center",
      "footprint": {
        "width": 1,
        "height": 1
      },
      "blocksMovement": true,
      "excludeGrass": true,
      "editorSelectable": true,
      "blockedCellOffsets": [
        {
          "x": 0,
          "y": 0
        }
      ],
      "allowedMapTypes": [],
      "actionPoints": [
        {
          "id": "examine_front",
          "playerCellOffset": {
            "x": 0,
            "y": -1
          },
          "playerFacing": "up",
          "actionType": "examine",
          "poseKey": null,
          "interactionText": "き。"
        }
      ]
    },
    {
      "definitionId": "house_main",
      "displayName": "家",
      "category": "fixture",
      "previewSpritePath": "Assets/Content/World/house_exterior.png",
      "visualWidthPixels": 160,
      "visualHeightPixels": 128,
      "rootAnchor": "bottom-center",
      "footprint": {
        "width": 5,
        "height": 2
      },
      "blockedCellOffsets": [
        {
          "x": -2,
          "y": 0
        },
        {
          "x": -1,
          "y": 0
        },
        {
          "x": 1,
          "y": 0
        },
        {
          "x": 2,
          "y": 0
        },
        {
          "x": -2,
          "y": 1
        },
        {
          "x": -1,
          "y": 1
        },
        {
          "x": 0,
          "y": 1
        },
        {
          "x": 1,
          "y": 1
        },
        {
          "x": 2,
          "y": 1
        }
      ],
      "blocksMovement": true,
      "excludeGrass": true,
      "allowedMapTypes": [],
      "editorSelectable": true,
      "actionPoints": []
    },
    {
      "definitionId": "bed_basic",
      "displayName": "ベッド",
      "category": "furniture",
      "previewSpritePath": "Assets/Content/World/house_bed.png",
      "visualWidthPixels": 64,
      "visualHeightPixels": 96,
      "rootAnchor": "bottom-left",
      "footprint": {
        "width": 2,
        "height": 3
      },
      "blockedCellOffsets": [
        {
          "x": 0,
          "y": 0
        },
        {
          "x": 1,
          "y": 0
        },
        {
          "x": 0,
          "y": 1
        },
        {
          "x": 1,
          "y": 1
        },
        {
          "x": 0,
          "y": 2
        },
        {
          "x": 1,
          "y": 2
        }
      ],
      "blocksMovement": true,
      "excludeGrass": true,
      "allowedMapTypes": [],
      "editorSelectable": true,
      "actionPoints": [
        {
          "id": "sleep_main",
          "playerCellOffset": {
            "x": 0,
            "y": -1
          },
          "playerFacing": "up",
          "actionType": "sleep",
          "poseKey": "bed_sleep",
          "interactionText": null
        }
      ]
    },
    {
      "definitionId": "cushion_basic",
      "displayName": "クッション",
      "category": "furniture",
      "previewSpritePath": "Assets/Content/World/cushion.png",
      "visualWidthPixels": 32,
      "visualHeightPixels": 32,
      "rootAnchor": "bottom-center",
      "footprint": {
        "width": 1,
        "height": 1
      },
      "blocksMovement": false,
      "excludeGrass": false,
      "editorSelectable": true,
      "blockedCellOffsets": [],
      "allowedMapTypes": [],
      "actionPoints": [
        {
          "id": "sit_main",
          "playerCellOffset": {
            "x": 0,
            "y": 0
          },
          "playerFacing": "up",
          "actionType": "sit",
          "poseKey": "cushion_sit",
          "interactionText": null
        }
      ]
    },
    {
      "definitionId": "sofa_basic",
      "displayName": "ソファー",
      "category": "furniture",
      "previewSpritePath": "Assets/Content/World/sofa.png",
      "visualWidthPixels": 64,
      "visualHeightPixels": 48,
      "rootAnchor": "bottom-left",
      "footprint": {
        "width": 2,
        "height": 1
      },
      "blocksMovement": true,
      "excludeGrass": true,
      "editorSelectable": true,
      "blockedCellOffsets": [
        {
          "x": 0,
          "y": 0
        },
        {
          "x": 1,
          "y": 0
        }
      ],
      "allowedMapTypes": [],
      "actionPoints": [
        {
          "id": "seat_left",
          "playerCellOffset": {
            "x": 0,
            "y": -1
          },
          "playerFacing": "up",
          "actionType": "sit",
          "poseKey": "bench_sit",
          "interactionText": null
        },
        {
          "id": "seat_right",
          "playerCellOffset": {
            "x": 1,
            "y": -1
          },
          "playerFacing": "up",
          "actionType": "sit",
          "poseKey": "bench_sit",
          "interactionText": null
        }
      ]
    },
    {
      "definitionId": "desk_basic",
      "displayName": "机",
      "category": "furniture",
      "previewSpritePath": "Assets/Content/World/desk.png",
      "visualWidthPixels": 64,
      "visualHeightPixels": 32,
      "rootAnchor": "bottom-left",
      "footprint": {
        "width": 2,
        "height": 1
      },
      "blocksMovement": true,
      "excludeGrass": true,
      "editorSelectable": true,
      "blockedCellOffsets": [
        {
          "x": 0,
          "y": 0
        },
        {
          "x": 1,
          "y": 0
        }
      ],
      "allowedMapTypes": [],
      "actionPoints": [
        {
          "id": "examine_front",
          "playerCellOffset": {
            "x": 0,
            "y": -1
          },
          "playerFacing": "up",
          "actionType": "examine",
          "poseKey": null,
          "interactionText": "つくえ。"
        }
      ]
    },
    {
      "definitionId": "bench_basic",
      "displayName": "ベンチ",
      "category": "fixture",
      "previewSpritePath": "Assets/Content/World/bench.png",
      "visualWidthPixels": 64,
      "visualHeightPixels": 32,
      "rootAnchor": "bottom-left",
      "footprint": {
        "width": 2,
        "height": 1
      },
      "blocksMovement": true,
      "excludeGrass": true,
      "editorSelectable": true,
      "blockedCellOffsets": [
        {
          "x": 0,
          "y": 0
        },
        {
          "x": 1,
          "y": 0
        }
      ],
      "allowedMapTypes": [],
      "actionPoints": [
        {
          "id": "seat_left",
          "playerCellOffset": {
            "x": 0,
            "y": -1
          },
          "playerFacing": "up",
          "actionType": "sit",
          "poseKey": "bench_sit",
          "interactionText": null
        },
        {
          "id": "seat_right",
          "playerCellOffset": {
            "x": 1,
            "y": -1
          },